Category,Title,File Path
Spotlight,Identity Lock_ Locking API Fine-tuned LLMs With Identity-based Wake Words.pdf,ICLR_2025_Papers/Spotlight/Identity Lock_ Locking API Fine-tuned LLMs With Identity-based Wake Words.pdf
Spotlight,Can Neural Networks Achieve Optimal Computational-statistical Tradeoff_ An Analysis on Single-Index .pdf,ICLR_2025_Papers/Spotlight/Can Neural Networks Achieve Optimal Computational-statistical Tradeoff_ An Analysis on Single-Index .pdf
Spotlight,A Feature-Aware Federated Learning Framework for Unsupervised Anomaly Detection in 5G Networks.pdf,ICLR_2025_Papers/Spotlight/A Feature-Aware Federated Learning Framework for Unsupervised Anomaly Detection in 5G Networks.pdf
Spotlight,GANDALF_ Generative AttentioN based Data Augmentation and predictive modeLing Framework for personal.pdf,ICLR_2025_Papers/Spotlight/GANDALF_ Generative AttentioN based Data Augmentation and predictive modeLing Framework for personal.pdf
Spotlight,NetMoE_ Accelerating MoE Training through Dynamic Sample Placement.pdf,ICLR_2025_Papers/Spotlight/NetMoE_ Accelerating MoE Training through Dynamic Sample Placement.pdf
Spotlight,Scaling Speech-Text Pre-training with Synthetic Interleaved Data.pdf,ICLR_2025_Papers/Spotlight/Scaling Speech-Text Pre-training with Synthetic Interleaved Data.pdf
Spotlight,Counterfactual Realizability.pdf,ICLR_2025_Papers/Spotlight/Counterfactual Realizability.pdf
Spotlight,MU-Bench_ A Multitask Multimodal Benchmark for Machine Unlearning.pdf,ICLR_2025_Papers/Spotlight/MU-Bench_ A Multitask Multimodal Benchmark for Machine Unlearning.pdf
Spotlight,Rewarding Progress_ Scaling Automated Process Verifiers for LLM Reasoning.pdf,ICLR_2025_Papers/Spotlight/Rewarding Progress_ Scaling Automated Process Verifiers for LLM Reasoning.pdf
Spotlight,ComaDICE_ Offline Cooperative Multi-Agent Reinforcement Learning with Stationary Distribution Shift .pdf,ICLR_2025_Papers/Spotlight/ComaDICE_ Offline Cooperative Multi-Agent Reinforcement Learning with Stationary Distribution Shift .pdf
Spotlight,Beyond Random Masking_ When Dropout meets Graph Convolutional Networks.pdf,ICLR_2025_Papers/Spotlight/Beyond Random Masking_ When Dropout meets Graph Convolutional Networks.pdf
Spotlight,No Need to Talk_ Asynchronous Mixture of Language Models.pdf,ICLR_2025_Papers/Spotlight/No Need to Talk_ Asynchronous Mixture of Language Models.pdf
Spotlight,AgentRefine_ Enhancing Agent Generalization through Refinement Tuning.pdf,ICLR_2025_Papers/Spotlight/AgentRefine_ Enhancing Agent Generalization through Refinement Tuning.pdf
Spotlight,Scaling LLM Test-Time Compute Optimally Can be More Effective than Scaling Parameters for Reasoning.pdf,ICLR_2025_Papers/Spotlight/Scaling LLM Test-Time Compute Optimally Can be More Effective than Scaling Parameters for Reasoning.pdf
Spotlight,RM-Bench_ Benchmarking Reward Models of Language Models with Subtlety and Style.pdf,ICLR_2025_Papers/Spotlight/RM-Bench_ Benchmarking Reward Models of Language Models with Subtlety and Style.pdf
Spotlight,Stochastic Sparse Sampling_ A Framework for Variable-Length Medical Time Series Classification.pdf,ICLR_2025_Papers/Spotlight/Stochastic Sparse Sampling_ A Framework for Variable-Length Medical Time Series Classification.pdf
Spotlight,Sparse autoencoders reveal selective remapping of visual concepts during adaptation.pdf,ICLR_2025_Papers/Spotlight/Sparse autoencoders reveal selective remapping of visual concepts during adaptation.pdf
Spotlight,CASAK-V_ Dynamic Sparse Attention and Adaptive KV-Cache Compression for Memory-Efficient Long-Contex.pdf,ICLR_2025_Papers/Spotlight/CASAK-V_ Dynamic Sparse Attention and Adaptive KV-Cache Compression for Memory-Efficient Long-Contex.pdf
Spotlight,Extending Flexibility of Image Coding Enhancement Framework for IoTs.pdf,ICLR_2025_Papers/Spotlight/Extending Flexibility of Image Coding Enhancement Framework for IoTs.pdf
Poster,Physics-Transfer Learning_ A Framework to Address the Accuracy-Performance Dilemma in Modeling Compl.pdf,ICLR_2025_Papers/Poster/Physics-Transfer Learning_ A Framework to Address the Accuracy-Performance Dilemma in Modeling Compl.pdf
Poster,Scaling Laws for Precision.pdf,ICLR_2025_Papers/Poster/Scaling Laws for Precision.pdf
Poster,Scalable Decision-Making in Stochastic Environments through Learned Temporal Abstraction.pdf,ICLR_2025_Papers/Poster/Scalable Decision-Making in Stochastic Environments through Learned Temporal Abstraction.pdf
Poster,Enhancing Efficiency and Regularization in Convolutional Neural Networks_ Strategies for Optimized D.pdf,ICLR_2025_Papers/Poster/Enhancing Efficiency and Regularization in Convolutional Neural Networks_ Strategies for Optimized D.pdf
Poster,Slashed Normal_ Parameterize Normal Posterior Distributions with KL Amplitude.pdf,ICLR_2025_Papers/Poster/Slashed Normal_ Parameterize Normal Posterior Distributions with KL Amplitude.pdf
Poster,GETMusic_ Generating Music Tracks with a Unified Representation and Diffusion Framework.pdf,ICLR_2025_Papers/Poster/GETMusic_ Generating Music Tracks with a Unified Representation and Diffusion Framework.pdf
Poster,Self-supervised contrastive learning performs non-linear system identification.pdf,ICLR_2025_Papers/Poster/Self-supervised contrastive learning performs non-linear system identification.pdf
Poster,LayerDAG_ A Layerwise Autoregressive Diffusion Model for Directed Acyclic Graph Generation.pdf,ICLR_2025_Papers/Poster/LayerDAG_ A Layerwise Autoregressive Diffusion Model for Directed Acyclic Graph Generation.pdf
Poster,Joint Reward and Policy Learning with Demonstrations and Human Feedback Improves Alignment.pdf,ICLR_2025_Papers/Poster/Joint Reward and Policy Learning with Demonstrations and Human Feedback Improves Alignment.pdf
Poster,RDAS_ A Low Latency and High Throughput Raw Data Engine for Machine Learning Systems.pdf,ICLR_2025_Papers/Poster/RDAS_ A Low Latency and High Throughput Raw Data Engine for Machine Learning Systems.pdf
Poster,Structure-Aware Parameter-Efficient Machine Unlearning on Transformer Models.pdf,ICLR_2025_Papers/Poster/Structure-Aware Parameter-Efficient Machine Unlearning on Transformer Models.pdf
Poster,DySpec_ Faster Speculative Decoding with Dynamic Token Tree Structure.pdf,ICLR_2025_Papers/Poster/DySpec_ Faster Speculative Decoding with Dynamic Token Tree Structure.pdf
Poster,Alternating Optimized Stochastic Vector Quantization in Neural Compression.pdf,ICLR_2025_Papers/Poster/Alternating Optimized Stochastic Vector Quantization in Neural Compression.pdf
Poster,Block Diffusion_ Interpolating Between Autoregressive and Diffusion Language Models.pdf,ICLR_2025_Papers/Poster/Block Diffusion_ Interpolating Between Autoregressive and Diffusion Language Models.pdf
Poster,Physics of Language Models_ Part 3_3_ Knowledge Capacity Scaling Laws.pdf,ICLR_2025_Papers/Poster/Physics of Language Models_ Part 3_3_ Knowledge Capacity Scaling Laws.pdf
Poster,Quality Measures for Dynamic Graph Generative Models.pdf,ICLR_2025_Papers/Poster/Quality Measures for Dynamic Graph Generative Models.pdf
Poster,Toward Human-Interpretable Explanations in a Unified Framework for GNNs.pdf,ICLR_2025_Papers/Poster/Toward Human-Interpretable Explanations in a Unified Framework for GNNs.pdf
Poster,In vivo cell-type and brain region classification via multimodal contrastive learning.pdf,ICLR_2025_Papers/Poster/In vivo cell-type and brain region classification via multimodal contrastive learning.pdf
Poster,Hottel Zone Physics-Constrained Networks for Furnaces.pdf,ICLR_2025_Papers/Poster/Hottel Zone Physics-Constrained Networks for Furnaces.pdf
Poster,VeSX_ A Framework Featured by Verification_ Self-Correction and In-context Learning for Web Automati.pdf,ICLR_2025_Papers/Poster/VeSX_ A Framework Featured by Verification_ Self-Correction and In-context Learning for Web Automati.pdf
Poster,Tuning Language Models by Mixture-of-Depths Ensemble.pdf,ICLR_2025_Papers/Poster/Tuning Language Models by Mixture-of-Depths Ensemble.pdf
Poster,Data Shapley in One Training Run.pdf,ICLR_2025_Papers/Poster/Data Shapley in One Training Run.pdf
Poster,MaestroMotif_ Skill Design from Artificial Intelligence Feedback.pdf,ICLR_2025_Papers/Poster/MaestroMotif_ Skill Design from Artificial Intelligence Feedback.pdf
Poster,SNAP-TTA_ Sparse Test-Time Adaptation for Latency-Sensitive Applications.pdf,ICLR_2025_Papers/Poster/SNAP-TTA_ Sparse Test-Time Adaptation for Latency-Sensitive Applications.pdf
Poster,MQuAKE-Remastered_ Multi-Hop Knowledge Editing Can Only Be Advanced with Reliable Evaluations.pdf,ICLR_2025_Papers/Poster/MQuAKE-Remastered_ Multi-Hop Knowledge Editing Can Only Be Advanced with Reliable Evaluations.pdf
Poster,ToolGen_ Unified Tool Retrieval and Calling via Generation.pdf,ICLR_2025_Papers/Poster/ToolGen_ Unified Tool Retrieval and Calling via Generation.pdf
Poster,MambaFormer-MOE_ Mamba-Transformer-based Mixture-of-Experts for Time Series Prediction.pdf,ICLR_2025_Papers/Poster/MambaFormer-MOE_ Mamba-Transformer-based Mixture-of-Experts for Time Series Prediction.pdf
Poster,How new data permeates LLM knowledge and how to dilute it.pdf,ICLR_2025_Papers/Poster/How new data permeates LLM knowledge and how to dilute it.pdf
Poster,RaSA_ Rank-Sharing Low-Rank Adaptation.pdf,ICLR_2025_Papers/Poster/RaSA_ Rank-Sharing Low-Rank Adaptation.pdf
Poster,JudgeLM_ Fine-tuned Large Language Models are Scalable Judges.pdf,ICLR_2025_Papers/Poster/JudgeLM_ Fine-tuned Large Language Models are Scalable Judges.pdf
Poster,Syntactic and Semantic Control of Large Language Models via Sequential Monte Carlo.pdf,ICLR_2025_Papers/Poster/Syntactic and Semantic Control of Large Language Models via Sequential Monte Carlo.pdf
Poster,Causally Motivated Sycophancy Mitigation for Large Language Models.pdf,ICLR_2025_Papers/Poster/Causally Motivated Sycophancy Mitigation for Large Language Models.pdf
Poster,Self-Improving Logic from Experimental Observations.pdf,ICLR_2025_Papers/Poster/Self-Improving Logic from Experimental Observations.pdf
Poster,Common Feature Learning for Zero-shot Image Recognition.pdf,ICLR_2025_Papers/Poster/Common Feature Learning for Zero-shot Image Recognition.pdf
Poster,Rethinking Neural Multi-Objective Combinatorial Optimization via Neat Weight Embedding.pdf,ICLR_2025_Papers/Poster/Rethinking Neural Multi-Objective Combinatorial Optimization via Neat Weight Embedding.pdf
Poster,GenBen_A Genarative Benchmark for LLM-Aided Design.pdf,ICLR_2025_Papers/Poster/GenBen_A Genarative Benchmark for LLM-Aided Design.pdf
Poster,Flow Matching for One-Step Sampling.pdf,ICLR_2025_Papers/Poster/Flow Matching for One-Step Sampling.pdf
Poster,Learning Fused State Representations for Control from Multi-View Observations.pdf,ICLR_2025_Papers/Poster/Learning Fused State Representations for Control from Multi-View Observations.pdf
Poster,Measuring and Enhancing Trustworthiness of LLMs in RAG through Grounded Attributions and Learning to.pdf,ICLR_2025_Papers/Poster/Measuring and Enhancing Trustworthiness of LLMs in RAG through Grounded Attributions and Learning to.pdf
Poster,Robustness Reprogramming for Representation Learning.pdf,ICLR_2025_Papers/Poster/Robustness Reprogramming for Representation Learning.pdf
Poster,KARPA_ A Training-free Method of Adapting Knowledge Graph as References for Large Language Model_s R.pdf,ICLR_2025_Papers/Poster/KARPA_ A Training-free Method of Adapting Knowledge Graph as References for Large Language Model_s R.pdf
Poster,UnoLoRA_ Single Low-Rank Adaptation for Efficient Multitask Fine-tuning.pdf,ICLR_2025_Papers/Poster/UnoLoRA_ Single Low-Rank Adaptation for Efficient Multitask Fine-tuning.pdf
Poster,Herb-GANNet_ Synthetic Data Generation through Conditional GANs for Improving Accuracy in Medicinal .pdf,ICLR_2025_Papers/Poster/Herb-GANNet_ Synthetic Data Generation through Conditional GANs for Improving Accuracy in Medicinal .pdf
Poster,Modeling Complex System Dynamics with Flow Matching Across Time and Conditions.pdf,ICLR_2025_Papers/Poster/Modeling Complex System Dynamics with Flow Matching Across Time and Conditions.pdf
Poster,Probabilistic Conformal Prediction with Approximate Conditional Validity.pdf,ICLR_2025_Papers/Poster/Probabilistic Conformal Prediction with Approximate Conditional Validity.pdf
Poster,BanglaGITI_ A Novel Dataset for Bangla Music Genre Classification with A Comprehensive Analysis.pdf,ICLR_2025_Papers/Poster/BanglaGITI_ A Novel Dataset for Bangla Music Genre Classification with A Comprehensive Analysis.pdf
Poster,Mitigating Privacy Risk of Adversarial Examples with Counterfactual Explanations.pdf,ICLR_2025_Papers/Poster/Mitigating Privacy Risk of Adversarial Examples with Counterfactual Explanations.pdf
Poster,Video Action Differencing.pdf,ICLR_2025_Papers/Poster/Video Action Differencing.pdf
Poster,Defining Deception in Decision Making.pdf,ICLR_2025_Papers/Poster/Defining Deception in Decision Making.pdf
Poster,A Systemic Review of Static Memory Analysis.pdf,ICLR_2025_Papers/Poster/A Systemic Review of Static Memory Analysis.pdf
Poster,Learning through Conditioning on Natural Language Feedback.pdf,ICLR_2025_Papers/Poster/Learning through Conditioning on Natural Language Feedback.pdf
Poster,Exploring the Recall of Language Models_ Case Study on Molecules.pdf,ICLR_2025_Papers/Poster/Exploring the Recall of Language Models_ Case Study on Molecules.pdf
Poster,Stacking Small Language Models for Generalizability.pdf,ICLR_2025_Papers/Poster/Stacking Small Language Models for Generalizability.pdf
Poster,Synergistic Approach for Simultaneous Optimization of Monolingual_ Cross-lingual_ and Multilingual I.pdf,ICLR_2025_Papers/Poster/Synergistic Approach for Simultaneous Optimization of Monolingual_ Cross-lingual_ and Multilingual I.pdf
Poster,Knowledge Entropy Decay during Language Model Pretraining Hinders New Knowledge Acquisition.pdf,ICLR_2025_Papers/Poster/Knowledge Entropy Decay during Language Model Pretraining Hinders New Knowledge Acquisition.pdf
Poster,Learning with Multi-Group Guarantees for Clusterable Subpopulations.pdf,ICLR_2025_Papers/Poster/Learning with Multi-Group Guarantees for Clusterable Subpopulations.pdf
Poster,MathOdyssey_ Benchmarking Mathematical Problem-Solving Skills in Large Language Models Using Odyssey.pdf,ICLR_2025_Papers/Poster/MathOdyssey_ Benchmarking Mathematical Problem-Solving Skills in Large Language Models Using Odyssey.pdf
Poster,Consistency Checks for Language Model Forecasters.pdf,ICLR_2025_Papers/Poster/Consistency Checks for Language Model Forecasters.pdf
Poster,Spider 2_0_ Evaluating Language Models on Real-World Enterprise Text-to-SQL Workflows.pdf,ICLR_2025_Papers/Poster/Spider 2_0_ Evaluating Language Models on Real-World Enterprise Text-to-SQL Workflows.pdf
Poster,Vietnamese Text-to-SQL with Large Language Models_ A Comprehensive Approach.pdf,ICLR_2025_Papers/Poster/Vietnamese Text-to-SQL with Large Language Models_ A Comprehensive Approach.pdf
Poster,Self-Improvement in Language Models_ The Sharpening Mechanism.pdf,ICLR_2025_Papers/Poster/Self-Improvement in Language Models_ The Sharpening Mechanism.pdf
Poster,The Good_ the Bad and the Ugly_ Watermarks_ Transferable Attacks and Adversarial Defenses.pdf,ICLR_2025_Papers/Poster/The Good_ the Bad and the Ugly_ Watermarks_ Transferable Attacks and Adversarial Defenses.pdf
Poster,Competition Dynamics Shape Algorithmic Phases of In-Context Learning.pdf,ICLR_2025_Papers/Poster/Competition Dynamics Shape Algorithmic Phases of In-Context Learning.pdf
Poster,Context-Parametric Inversion_ Why Instruction Finetuning May Not Actually Improve Context Reliance.pdf,ICLR_2025_Papers/Poster/Context-Parametric Inversion_ Why Instruction Finetuning May Not Actually Improve Context Reliance.pdf
Poster,Achieving Exact Federated Unlearning with Improved Post-Unlearning Performance.pdf,ICLR_2025_Papers/Poster/Achieving Exact Federated Unlearning with Improved Post-Unlearning Performance.pdf
Poster,Neural Wave Equation for Irregularly Sampled Sequence Data.pdf,ICLR_2025_Papers/Poster/Neural Wave Equation for Irregularly Sampled Sequence Data.pdf
Poster,Diffusion-Based Planning for Autonomous Driving with Flexible Guidance.pdf,ICLR_2025_Papers/Poster/Diffusion-Based Planning for Autonomous Driving with Flexible Guidance.pdf
Poster,Brain Bandit_ A Biologically Grounded Neural Network for Efficient Control of Exploration.pdf,ICLR_2025_Papers/Poster/Brain Bandit_ A Biologically Grounded Neural Network for Efficient Control of Exploration.pdf
Poster,Internet of Agents_ Weaving a Web of Heterogeneous Agents for Collaborative Intelligence.pdf,ICLR_2025_Papers/Poster/Internet of Agents_ Weaving a Web of Heterogeneous Agents for Collaborative Intelligence.pdf
Poster,Investigating Self-Attention_ Its Impact on Sample Efficiency in Deep Reinforcement Learning.pdf,ICLR_2025_Papers/Poster/Investigating Self-Attention_ Its Impact on Sample Efficiency in Deep Reinforcement Learning.pdf
Poster,DarkBench_ Benchmarking Dark Patterns in Large Language Models.pdf,ICLR_2025_Papers/Poster/DarkBench_ Benchmarking Dark Patterns in Large Language Models.pdf
Poster,Temporal Environment-Aware Image Generation via Latent Diffusion.pdf,ICLR_2025_Papers/Poster/Temporal Environment-Aware Image Generation via Latent Diffusion.pdf
Poster,Bayesian-LoRA_ LoRA based Parameter Efficient Fine-Tuning using Optimal Quantization levels and Rank.pdf,ICLR_2025_Papers/Poster/Bayesian-LoRA_ LoRA based Parameter Efficient Fine-Tuning using Optimal Quantization levels and Rank.pdf
Poster,TopoLM_ brain-like spatio-functional organization in a topographic language model.pdf,ICLR_2025_Papers/Poster/TopoLM_ brain-like spatio-functional organization in a topographic language model.pdf
Poster,ESMGain_ Effective and Efficient Prediction of Mutation_s functional Effect via ESM2 Transfer Learni.pdf,ICLR_2025_Papers/Poster/ESMGain_ Effective and Efficient Prediction of Mutation_s functional Effect via ESM2 Transfer Learni.pdf
Poster,Recovering Plasticity of Neural Networks via Soft Weight Rescaling.pdf,ICLR_2025_Papers/Poster/Recovering Plasticity of Neural Networks via Soft Weight Rescaling.pdf
Poster,Compositional simulation-based inference for time series.pdf,ICLR_2025_Papers/Poster/Compositional simulation-based inference for time series.pdf
Poster,Distributed Quasi-Newton Method for Fair and Fast Federated Learning.pdf,ICLR_2025_Papers/Poster/Distributed Quasi-Newton Method for Fair and Fast Federated Learning.pdf
Poster,Learning-Augmented Frequent Directions.pdf,ICLR_2025_Papers/Poster/Learning-Augmented Frequent Directions.pdf
Poster,When GNNs meet symmetry in ILPs_ an orbit-based feature augmentation approach.pdf,ICLR_2025_Papers/Poster/When GNNs meet symmetry in ILPs_ an orbit-based feature augmentation approach.pdf
Poster,Shared Memory for Multi-agent Lifelong Pathfinding.pdf,ICLR_2025_Papers/Poster/Shared Memory for Multi-agent Lifelong Pathfinding.pdf
Poster,On the Robustness of Vision-Language Models Against Distractions.pdf,ICLR_2025_Papers/Poster/On the Robustness of Vision-Language Models Against Distractions.pdf
Poster,Neuroacoustic Patterns_ Constant Q Cepstral Coefficients for the Classification of Neurodegenerative.pdf,ICLR_2025_Papers/Poster/Neuroacoustic Patterns_ Constant Q Cepstral Coefficients for the Classification of Neurodegenerative.pdf
Poster,Harmonic Machine Learning Models are Robust.pdf,ICLR_2025_Papers/Poster/Harmonic Machine Learning Models are Robust.pdf
Poster,Exploring New Frontiers in Vertical Federated Learning_ the Role of Saddle Point Reformulation.pdf,ICLR_2025_Papers/Poster/Exploring New Frontiers in Vertical Federated Learning_ the Role of Saddle Point Reformulation.pdf
Poster,Optimal Transport for Time Series Imputation.pdf,ICLR_2025_Papers/Poster/Optimal Transport for Time Series Imputation.pdf
Poster,Robust Root Cause Diagnosis using In-Distribution Interventions.pdf,ICLR_2025_Papers/Poster/Robust Root Cause Diagnosis using In-Distribution Interventions.pdf
Poster,Bias in CLIP Encoders_ A Study of Encoder Bias and Object Representation in Multi-Object Scenarios.pdf,ICLR_2025_Papers/Poster/Bias in CLIP Encoders_ A Study of Encoder Bias and Object Representation in Multi-Object Scenarios.pdf
Poster,Offline Model-Based Optimization by Learning to Rank.pdf,ICLR_2025_Papers/Poster/Offline Model-Based Optimization by Learning to Rank.pdf
Poster,MOMENTUM MEETS VIRALITY_ A NOVEL METRIC FOR UNMASKING SOCIAL BIAS IN VIRAL TWEETS.pdf,ICLR_2025_Papers/Poster/MOMENTUM MEETS VIRALITY_ A NOVEL METRIC FOR UNMASKING SOCIAL BIAS IN VIRAL TWEETS.pdf
Poster,CGD_ Modifying the Loss Landscape by Gradient Regularization.pdf,ICLR_2025_Papers/Poster/CGD_ Modifying the Loss Landscape by Gradient Regularization.pdf
Poster,Learning to Discover Regulatory Elements for Gene Expression Prediction.pdf,ICLR_2025_Papers/Poster/Learning to Discover Regulatory Elements for Gene Expression Prediction.pdf
Poster,Recovering Knowledge by Hardening Language Models.pdf,ICLR_2025_Papers/Poster/Recovering Knowledge by Hardening Language Models.pdf
Poster,TabM_ Advancing tabular deep learning with parameter-efficient ensembling.pdf,ICLR_2025_Papers/Poster/TabM_ Advancing tabular deep learning with parameter-efficient ensembling.pdf
Poster,Activation Gradient based Poisoned Sample Detection Against Backdoor Attacks.pdf,ICLR_2025_Papers/Poster/Activation Gradient based Poisoned Sample Detection Against Backdoor Attacks.pdf
Poster,Improving the Sparse Structure Learning of Spiking Neural Networks from the View of Compression Effi.pdf,ICLR_2025_Papers/Poster/Improving the Sparse Structure Learning of Spiking Neural Networks from the View of Compression Effi.pdf
Poster,PIED_ Physics-Informed Experimental Design for Inverse Problems.pdf,ICLR_2025_Papers/Poster/PIED_ Physics-Informed Experimental Design for Inverse Problems.pdf
Poster,Inference Scaling for Long-Context Retrieval Augmented Generation.pdf,ICLR_2025_Papers/Poster/Inference Scaling for Long-Context Retrieval Augmented Generation.pdf
Poster,UniCBE_ An Uniformity-driven Comparing Based Evaluation Framework with Unified Multi-Objective Optim.pdf,ICLR_2025_Papers/Poster/UniCBE_ An Uniformity-driven Comparing Based Evaluation Framework with Unified Multi-Objective Optim.pdf
Poster,The Rate-Distortion-Perception Trade-Off with Algorithmic Realism.pdf,ICLR_2025_Papers/Poster/The Rate-Distortion-Perception Trade-Off with Algorithmic Realism.pdf
Poster,DailyDilemmas_ Revealing Value Preferences of LLMs with Quandaries of Daily Life.pdf,ICLR_2025_Papers/Poster/DailyDilemmas_ Revealing Value Preferences of LLMs with Quandaries of Daily Life.pdf
Poster,MAP_ Multi-Human-Value Alignment Palette.pdf,ICLR_2025_Papers/Poster/MAP_ Multi-Human-Value Alignment Palette.pdf
Poster,MAC-CAFE_ Multi-actor_ Centralized Critic Architecture for Feedback-driven Editing.pdf,ICLR_2025_Papers/Poster/MAC-CAFE_ Multi-actor_ Centralized Critic Architecture for Feedback-driven Editing.pdf
Poster,RL4CO_ an Extensive Reinforcement Learning for Combinatorial Optimization Benchmark.pdf,ICLR_2025_Papers/Poster/RL4CO_ an Extensive Reinforcement Learning for Combinatorial Optimization Benchmark.pdf
Poster,Defend against Jailbreak Attacks via Debate with Partially Perceptive Agents.pdf,ICLR_2025_Papers/Poster/Defend against Jailbreak Attacks via Debate with Partially Perceptive Agents.pdf
Poster,OpenCity_ A Scalable Platform to Simulate Urban Activities with Massive LLM Agents.pdf,ICLR_2025_Papers/Poster/OpenCity_ A Scalable Platform to Simulate Urban Activities with Massive LLM Agents.pdf
Poster,Spread Preference Annotation_ Direct Preference Judgment for Efficient LLM Alignment.pdf,ICLR_2025_Papers/Poster/Spread Preference Annotation_ Direct Preference Judgment for Efficient LLM Alignment.pdf
Poster,Learning to Search from Demonstration Sequences.pdf,ICLR_2025_Papers/Poster/Learning to Search from Demonstration Sequences.pdf
Poster,Large-Scale Multi-Agent Reinforcement Learning for Traffic Signal Optimization.pdf,ICLR_2025_Papers/Poster/Large-Scale Multi-Agent Reinforcement Learning for Traffic Signal Optimization.pdf
Poster,Capturing the Temporal Dependence of Training Data Influence.pdf,ICLR_2025_Papers/Poster/Capturing the Temporal Dependence of Training Data Influence.pdf
Poster,Layer-Wise Quantization_ A Pragmatic and Effective Method for Quantizing LLMs.pdf,ICLR_2025_Papers/Poster/Layer-Wise Quantization_ A Pragmatic and Effective Method for Quantizing LLMs.pdf
Poster,Network-based Active Inference for Adaptive and Cost-efficient Real-World Applications_ PV Panel Ins.pdf,ICLR_2025_Papers/Poster/Network-based Active Inference for Adaptive and Cost-efficient Real-World Applications_ PV Panel Ins.pdf
Poster,Re-examining learning linear functions in context.pdf,ICLR_2025_Papers/Poster/Re-examining learning linear functions in context.pdf
Poster,Bayesian Treatment of the Spectrum of the Empirical Kernel in (Sub)Linear-Width Neural Networks.pdf,ICLR_2025_Papers/Poster/Bayesian Treatment of the Spectrum of the Empirical Kernel in (Sub)Linear-Width Neural Networks.pdf
Poster,StarCraft II Arena_ Evaluating LLMs in Strategic Planning_ Real-Time Decision Making_ and Adaptabili.pdf,ICLR_2025_Papers/Poster/StarCraft II Arena_ Evaluating LLMs in Strategic Planning_ Real-Time Decision Making_ and Adaptabili.pdf
Poster,C-Adam_ Confidence-Based Optimization for Online Learning.pdf,ICLR_2025_Papers/Poster/C-Adam_ Confidence-Based Optimization for Online Learning.pdf
Poster,Direct Post-Training Preference Alignment for Multi-Agent Motion Generation Model Using Implicit Fee.pdf,ICLR_2025_Papers/Poster/Direct Post-Training Preference Alignment for Multi-Agent Motion Generation Model Using Implicit Fee.pdf
Poster,Estimating the Probabilities of Rare Outputs in Language Models.pdf,ICLR_2025_Papers/Poster/Estimating the Probabilities of Rare Outputs in Language Models.pdf
