Category,Title,File Path
Poster,Model Comparisons_ XNet Outperforms KAN.pdf,ICLR_2025_Papers/Poster/Model Comparisons_ XNet Outperforms KAN.pdf
Poster,StreamingBench_ Assessing the Gap for MLLMs to Achieve Streaming Video Understanding.pdf,ICLR_2025_Papers/Poster/StreamingBench_ Assessing the Gap for MLLMs to Achieve Streaming Video Understanding.pdf
Poster,EXecution-Eval_ Can language models execute real-world code_.pdf,ICLR_2025_Papers/Poster/EXecution-Eval_ Can language models execute real-world code_.pdf
Poster,TabReD_ Analyzing Pitfalls and Filling the Gaps in Tabular Deep Learning Benchmarks.pdf,ICLR_2025_Papers/Poster/TabReD_ Analyzing Pitfalls and Filling the Gaps in Tabular Deep Learning Benchmarks.pdf
Poster,Multi-Label Test-Time Adaptation with Bound Entropy Minimization.pdf,ICLR_2025_Papers/Poster/Multi-Label Test-Time Adaptation with Bound Entropy Minimization.pdf
Poster,Computationally Efficient RL under Linear Bellman Completeness for Deterministic Dynamics.pdf,ICLR_2025_Papers/Poster/Computationally Efficient RL under Linear Bellman Completeness for Deterministic Dynamics.pdf
Poster,From Search to Sampling_ Generative Models for Robust Algorithmic Recourse.pdf,ICLR_2025_Papers/Poster/From Search to Sampling_ Generative Models for Robust Algorithmic Recourse.pdf
Poster,Online Preference Alignment for Language Models via Count-based Exploration.pdf,ICLR_2025_Papers/Poster/Online Preference Alignment for Language Models via Count-based Exploration.pdf
Poster,Evaluating Synthetic Activations composed of SAE Latents in GPT-2.pdf,ICLR_2025_Papers/Poster/Evaluating Synthetic Activations composed of SAE Latents in GPT-2.pdf
Poster,Identity Lock_ Locking API Fine-tuned LLMs With Identity-based Wake Words.pdf,ICLR_2025_Papers/Poster/Identity Lock_ Locking API Fine-tuned LLMs With Identity-based Wake Words.pdf
Poster,Can Neural Networks Achieve Optimal Computational-statistical Tradeoff_ An Analysis on Single-Index .pdf,ICLR_2025_Papers/Poster/Can Neural Networks Achieve Optimal Computational-statistical Tradeoff_ An Analysis on Single-Index .pdf
Poster,A Feature-Aware Federated Learning Framework for Unsupervised Anomaly Detection in 5G Networks.pdf,ICLR_2025_Papers/Poster/A Feature-Aware Federated Learning Framework for Unsupervised Anomaly Detection in 5G Networks.pdf
Poster,GANDALF_ Generative AttentioN based Data Augmentation and predictive modeLing Framework for personal.pdf,ICLR_2025_Papers/Poster/GANDALF_ Generative AttentioN based Data Augmentation and predictive modeLing Framework for personal.pdf
Poster,NetMoE_ Accelerating MoE Training through Dynamic Sample Placement.pdf,ICLR_2025_Papers/Poster/NetMoE_ Accelerating MoE Training through Dynamic Sample Placement.pdf
Poster,Scaling Speech-Text Pre-training with Synthetic Interleaved Data.pdf,ICLR_2025_Papers/Poster/Scaling Speech-Text Pre-training with Synthetic Interleaved Data.pdf
Poster,Counterfactual Realizability.pdf,ICLR_2025_Papers/Poster/Counterfactual Realizability.pdf
Poster,MU-Bench_ A Multitask Multimodal Benchmark for Machine Unlearning.pdf,ICLR_2025_Papers/Poster/MU-Bench_ A Multitask Multimodal Benchmark for Machine Unlearning.pdf
Poster,Rewarding Progress_ Scaling Automated Process Verifiers for LLM Reasoning.pdf,ICLR_2025_Papers/Poster/Rewarding Progress_ Scaling Automated Process Verifiers for LLM Reasoning.pdf
Poster,ComaDICE_ Offline Cooperative Multi-Agent Reinforcement Learning with Stationary Distribution Shift .pdf,ICLR_2025_Papers/Poster/ComaDICE_ Offline Cooperative Multi-Agent Reinforcement Learning with Stationary Distribution Shift .pdf
Poster,Beyond Random Masking_ When Dropout meets Graph Convolutional Networks.pdf,ICLR_2025_Papers/Poster/Beyond Random Masking_ When Dropout meets Graph Convolutional Networks.pdf
Poster,No Need to Talk_ Asynchronous Mixture of Language Models.pdf,ICLR_2025_Papers/Poster/No Need to Talk_ Asynchronous Mixture of Language Models.pdf
Poster,AgentRefine_ Enhancing Agent Generalization through Refinement Tuning.pdf,ICLR_2025_Papers/Poster/AgentRefine_ Enhancing Agent Generalization through Refinement Tuning.pdf
Poster,Scaling LLM Test-Time Compute Optimally Can be More Effective than Scaling Parameters for Reasoning.pdf,ICLR_2025_Papers/Poster/Scaling LLM Test-Time Compute Optimally Can be More Effective than Scaling Parameters for Reasoning.pdf
Poster,RM-Bench_ Benchmarking Reward Models of Language Models with Subtlety and Style.pdf,ICLR_2025_Papers/Poster/RM-Bench_ Benchmarking Reward Models of Language Models with Subtlety and Style.pdf
Poster,Stochastic Sparse Sampling_ A Framework for Variable-Length Medical Time Series Classification.pdf,ICLR_2025_Papers/Poster/Stochastic Sparse Sampling_ A Framework for Variable-Length Medical Time Series Classification.pdf
Poster,Sparse autoencoders reveal selective remapping of visual concepts during adaptation.pdf,ICLR_2025_Papers/Poster/Sparse autoencoders reveal selective remapping of visual concepts during adaptation.pdf
Poster,CASAK-V_ Dynamic Sparse Attention and Adaptive KV-Cache Compression for Memory-Efficient Long-Contex.pdf,ICLR_2025_Papers/Poster/CASAK-V_ Dynamic Sparse Attention and Adaptive KV-Cache Compression for Memory-Efficient Long-Contex.pdf
Poster,Extending Flexibility of Image Coding Enhancement Framework for IoTs.pdf,ICLR_2025_Papers/Poster/Extending Flexibility of Image Coding Enhancement Framework for IoTs.pdf
